,Argentina,Arándanos,Actualización de requisitos,,2016,03/05/2016,May-16,Finalizado,"03.05.16 En carta SAG N°2785/2016, informa a SENASA que actualizará los requisitos fitosanitarios de importación para arándanos frescos, para asegurar una correcta certificación en los términos convenidos",,,,,,
VIVEROS,Brasil,Bulbos de Lilium,Apertura,,2006,29/10/2016,,Pendiente Brasil,"Definido por la DPAF como 1° priorización (30 marzo 2016). 18.10.16 Mediante el  Oficio N°4236 de la Direcon, se  remite oficio N° 451/2016/DSV/MAPA del 5 de octubre 2016, propuesta de instrucción de normativa sobre los requisitos fitosanitarios para la importación de bulbos en reposo vegetativo y plántulas in vitro de lirio (Lilium sp.) provenientes de Chile. Además, se solicita  a SAG informaciòn adicional.",,,,,,
VIVEROS,Brasil,Plantas de Arándanos,Apertura,,2012,01/09/2016,,Pendiente Brasil,"14.07.15 Vía correo electrónico DPAF realiza comentarios a la propuesta enviada. Se solicita a AAEn abril, julio y septiembre del 2016 se ha solicitado la gestión a la AA y consulte ante la DSV sobre el estado de avance a este tema pendiente, hasta la fecha sin respuesta",,,,,,
ASOEX,Brasil,System Approach de Kiwi  (Actinidia deliciosa),Facilitación,,2012,13/06/2016,31/05/2016,Finalizado,Desde el 31 de mayo 2016 el SAG se da inicio a la certificación para la  exportación de frutos frescos de kiwi bajo System approach.  ,,,,,,
ASOEX,Guatemala,Arándanos frescos,Apertura,Privado,2015,13/05/2016,,Pendiente MAGA,MAGA debe responder carta enviada por el SAG en abril del 2016. El MAGA debe enviar la carta de comrpomiso para la visita de inspección. Aún  se mantiene la discusión respecto a la eliminación de Pseudococcus vibirni de los requisitos fitosanitarios.,,,,,,
,Japón,Cerezas bajo esquema systems approach,Facilitación,,42125,23/06/2016,,Pendiente MAFF,"DPAF ha revisado la propuesta de Plan de Trabajo enviada por MAFF y se ha complementado con aspectos que no aparecían detallados (como por ejemplo la cantidad de trampas a ser instaladas en huertos, etc.) y se ha enviado a Japón. SAG envía comentarios y observaciones a la propuesta enviada por MAFF para gestión de la AA. ",,,,,,
,Corea del Sur,Cerezas,Apertura,"Gremio, Cci",40878,,Jan-16,Finalizado,"El 7 de enero 2016 se recibe carta de QIA informando que ha permitido el ingreso de la  cereza fresca de Chile al mercado coreano, bajo el cumplimiento de Systems Approach acordado entre ambos organismos. ",,,,,,
Vivero jardín pehuén,Bolivia,Plantines de Araucaria,Apertura,Privados,41897,26/08/2015,01/12/2015,Detenido sin interes,"El 15 de marzo de 2016, se insiste a interesado por cuestionario de ARP. El 26 de agosto de 2015, se solicito al vivero complementar respuestas al cuestionario de ARP, para posteriormente continuar con envío a Bolivia.DESCARTADO POR QUE INTERESADO NO ENVIA INFORMACIÓN",,,,,,
Campex Baer Ltda,Bolivia,Semillas de lupino,Apertura,Privados,42107,15/03/2016,,Pendiente interesado,"El 4 de noviembre, se remiten comentarios a información presentada por Semillas BAER (14 de octubre). Se reitera el 15 de diciembre 2015.El 15 de marzo de 2016, se insiste por información, en caso de que no exista respuesta se descartará de los temas a trabajar.",,,,,,
ANPROS,Colombia,Semillas de arroz,Apertura,Privados,42089,26/10/2015,, Pendiente ICA,"5° Prioridad. El 26 de junio a través de nota SAG N° 3596/2015, se remite a ICA el cuestionario de ARP para su análisis. En VI reunión MSF del Acuerdo Chile-Colombia  (26 de octubre 2015) se establece como quinta prioridad a trabajar


",,,,,,
Maqui New Life,Colombia,Maqui IQF,Apertura,"Privados, ICA",42037,24/03/2016,29/05/2016,Finalizado,"El 29 de mayo 2016 mediante Oficio Nro. 20162105941, ICA comunica que el producto corresponde a categoría de riesgo 1 por lo cual no requiere de CZE.",,,,,,
Viveros Chile,Colombia,Plantas de palto,Apertura,Gremio,41829,12/06/2015,,Pendiente interesado,"El 12 de junio de 2015, se insiste a Viveros Chile remitir la información para completar el cuestionario de ARP.  El 3 de julio se indica desde viveros Chile que están gestionando la información. Ya existen 4 productos priorizados, por lo cual se esperaran avances para insistir.",,,,,,
ANPROS,Colombia,Semilla de maiz,Apertura,Gremio,42370,20/09/2016,,Pendiente ICA,"20 de septiembre 2016, se envía solicitud de inicio de ARP para semillas de maíz (carta SAG N° 5711/2016",,,,,,
Agrícola Llahuen S.A,Colombia,Semilla de esparrago,Apertura,Privados,42133,29/09/2015,, Pendiente SAG,"4° Prioridad En VI reunión MSF del Acuerdo Chile-Colombia  (26 de octubre 2015) se establece como cuarta prioridad a trabajar, antecedentes enviados el 29 de septiembre de 2015. En septiembre se recibe Nota ICA N° 20162114920, con las exigencias de ingreso para semillas de esparrago destino investigación. Se encuentra en análisis respuesta debido a que el uso de interés es siembra para comercialización",,,,,,
Paisajismo Jorge Alberto Nuñez Lagos,Colombia,Astillas secas al natural libres de corteza y teñidas,Apertura,Privados,42166,18.08.2016,,Pendiente ICA,"El 01 de junio se recibe Oficio Nro. 20162102557, se informan las exigencias de importación (tratamiento 71.1 °C por 75 min.). 18 de agosto 2016 (Carta SAG N° 5111.2016), se solicita autorizar tratamiento térmico acorde a NIMF 15. Pendiente ICA",,,,,,
ASOEX,Ecuador,Granadas,Apertura,"Gremio, AGROCALIDAD",41516,13/09/2016,,Pendiente SAG ,El 13 de septiembre 2016 se recibe contrapropuesta de exigencias fitosanitarias. SAG debe proponer PT.,,,,,,
ASOEX,Ecuador,Arandanos,Apertura,"Gremio, AGROCALIDAD",42052,12/09/2016,,Pendiente SAG,"Mediante Oficio Nro. MAGAP-DSV/AGROCALIDAD-2016-000536-0F del 12 de septiembre, AGROCALIDAD mantiene en las exigencias las plagas P. calceolaridae, Diaspidiotus anyclus, P.longispinus y P. viburni",,,,,,
Viveros Chile,Ecuador,Plantas de duraznero,Apertura,Privados,41456,21/01/2015,,Pendiente AGROCALIDAD,"El 21 de enero de 2015, se solicita a traves de carta eliminar de los requisitos a hongo Armillaria luteobubalina al ser plaga no presente en Chile. ",,,,,,
ANPROS,Ecuador,Semillas de esparrago,Apertura,"Privados, AGROCALIDAD",42117,26/11/2015,,Pendiente AGROCALIDAD,"El 26 de noviembre de 2015, se envía cuestionario de ARP. Debe ser analizado por la ONPF.",,,,,,
CORMA,Ecuador,Maderas impregnadas,Facilitación,SAG,41730,20/11/2016,,Pendiente AGROCALIDAD,"Durante la Gira del DN del SAG a Ecuador (6 de nov), AGROCALIDAD informa que ARP se encuentra en etapa 3 y que se espera su término para el 1° semestre del 2016. Se insiste a traves de PROCHILE en Ecuador. 20 noviembre 2016.",,,,,,
CORMA/Infodema,Ecuador,Rollizos de Eucaliptus nitens,Apertura,Privados,41913,15/01/2016,enero-2016,Tema detenido. ,"Ante la insistencia de PROCHILE en Ecuador (19 de enero 2016), AGROCALIDAD informó que la Subsecretaria de Producción Forestal se contactó con la empresa destino (Enchapes Decorativos S.A) y estos comunicaron que no habría interés para el ingreso de una muestra",,,,,,
ASOEX,Israel,Arandanos,Apertura,Gremio,41305,14/10/2016,,Pendiente Israel,A traves de mail se envian comentarios a la propuesta de exigencias planteadas por Israel. Se comenta el daño que provoca el bromuro a este producto y se indica que la inspección aplicada por SAG es suficiente para certificar un envío con nivel adecuado de protección.,,,,,,
APEF,Irán,Bulbos de lilium,Apertura,Gremio/Iran,41974,30/03/2016,,Pendiente Iran,"El 30 de marzo de 2016, se envía antecedentes necesarios para que la ONPF de Iran de inicio al ARP, se informar fecha de inicio.",,,,,,
ASOEX,Tailandia,Peras,Apertura,ASOEX,41456,08/06/2016,,Pendiente Tailandia,"Cuestionario de ARP enviado en junio 2015.El 8 de junio de 2016 y considerando la reunión MSF del TLC, se envían prioridades agrícolas (carta SAG N° 3682/2016; Nota Embajada V009/2016). El orden de prioridad corresponde a: Frutos de Pera- semillas de maíz- semillas de repollo.",,,,,,
Syngenta,Tailandia,Semillas de investigación,Apertura,Privados,41516,14/09/2016,,Pendiente Tailandia,"En reunión MSF Chile-Tailandia, Se entregan los requisitos para este producto y se indica que el permiso de importación para investigación deberá ser solicitado en cada envío. Cuestionario de ARP enviado en mayo 2015.Una vez recibidas las exigencias fitosanitarias, se envian comentariosrespecto a la dosis de fumigación, al tratamiento antifungico y se solicita retirar algunas plagas, dao que no estan presentes en Chile.",,,,,,
,Tailandia,Semillas de repollo,Apertura,Privados,febreo-2016,08/06/2016,,Pendiente Tailandia,"El 8 de junio de 2016 y considerando la reunión MSF del TLC, se envían prioridades agrícolas (carta SAG N° 3682/2016; Nota Embajada V009/2016). El orden de prioridad corresponde a: Frutos de Pera- semillas de maíz- semillas de repollo.",,,,,,
CORMA,Tailandia,Requisitos fitosanisarios tableros,Apertura,SAG,42359,07/04/2016,,Pendiente Tailandia,"7 de abril 2016: Comité MSF, Acuerdo Comercial Chile-Tailandia. Los temas presentados por SAG corresponden por orden de prioridad a: ",,,,,,
ANPROS,Venezuela,Semillas de maiz,Apertura,Gremio,41898,14/03/2016,,Pendiente Venezuela,,,,,,,
Viveros Chile/Hortifrut,Perú,Plantas de zarzamora,Apertura,Privados/SENASA,41871,24/05/2016,,Pendiente Perú,1.- Carne de cerdo, 2.- Frutos de Peras, 3.- Productos lácteos, 4.-Semilla de maíz, 5.- Carne bovino y ovino, 6.- Cueros varias sp., 7.- Requisitos  fitosanitarios tableros de madera. 
Viveros Chile,Perú,Plantas de almendro (Prunus dulcis),Apertura,Gremio,41975,08/04/2016,julio/2016,Finalizado,"RESOLUCIÓN DIRECTORAL 0028-2016-MINAGRI-SENASA-DSV, JULIO DE 2016 ",,,,,,
Viveros Chile,Perú,Plantas de ciruelo,Apertura,Privados/SENASA,42011,05/08/2016,,Pendiente Perú,"El 7 de octubre de 2015 mediante carta SAG N° 5984/2015, se solicita reconocer el estado de plaga cuarentenaria ausente en Chile para Cherry leaf roll virus. Tercera prioridad ARP MP (Carta 4856/2016)",,,,,,
Viveros Chile,Perú,Plantas de arándano,Apertura,Privados/SENASA,42223,01/09/2016,agosto-2016,Finalizado,"DECLARACIÓN ADICIONAL Y TRATAMIENTO CUARENTENARIO (FUENTE: RESOLUCIÓN DIRECTORAL 031-2016-MINAGRI-SENASA-DSV) Exigencias actualizadas interés SENASA, entrada en vigor agosto 2016. El 1 de septiembre (Carta SAG N° 5398/2016), se solicita modificar método de aplicación de los tratamientos, se ofrece método alternativo. ",,,,,,
Viveros Chile,Perú,Plantas in vitro de café y lillium spp.,Apertura,Privados/SENASA,42440,17/03/2016,,Pendiente interesado,El 17 de marzo se distribuye el cuestionario de ARP a vivero hijuelas y a DPAF.,,,,,,
Viveros Chile,Perú,Plantas de remolacha,Apertura,Privados/SENASA,42164,08/04/2016,,Pendiente interesado,"El 8 de abril de 2016, se solicita a DPAF consultar por otro interesado, si no se eliminará de los temas a tratar.",,,,,,
Viveros Chile,Perú,Plantas de pistacho,Apertura,Privados/SENASA,42146,05/08/2016,,Pendiente Perú,"15 de agosto (Carta SAG N° 6184/2015), SAG insiste en el retiro de Phytophthora cambivora, Eutypa lata, Aonidiella aurantii, Lepidosaphes conchiformis y Phytophthora megasperma. Segunda prioridad ARP MP (carta  N°4826/2016)                                                                                                  ",,,,,,
Viveros Chile,Perú,Plantas de avellano,Apertura,Privados/SENASA,42142,08/04/2016,agosto-2016,Finalizado,"El 27 de agosto 2016 se recibe Nota-0464-2016-MINAGRI-SENASA-DSV, se comunica la publicación de las exigencias de avellano a través de Resolución Directoral N° 0027-2016-MINAGRI-SENASA-DSV",,,,,,
VIVEROS,Argentina,Material de propagación de Palto   (Persea americana)            ,Apertura,,41883,,junio-2015,Tema finalizado. S,e establecieron requisitos. SAG acepta requisito en carta N°3442/2015,,,,,,
VIVEROS,Argentina,Material de propagación de olivos,Actualización requisitos,,42005,,agosto-2015,Tema finalizado. ,Requisitos establecidos. 14.09.15 SENASA envia AFIDI.,,,,,,
,Argentina,Kits de cajas contrachapadas,Apertura,,42309,02/12/2015,enero-2016,Finalizado,Requisitos establecidos.,,,,,,
VIVEROS,Brasil,Estacas de Vid,Apertura,,41183,14/07/2015,,Pendiente Brasil,"Definido por DPAF como 2da prioridad. El tema que se reactivó el 2015, se acordó con el MAPA trabajar en conjunto un formato de normativa para agilizar este proceso. 14.07.15  SAG envía a AA la aprobación de de la propuesta de normativa en portugués . 


",,,,,,
,Costa Rica,Chapa de eucaliptus,Apertura,,42217,01/10/2015,nov-2015,Finalizado,.El  20.10.15 MAG envía nota DSFE N°826 con los requisitos fitosanitarios.,,,,,,
,Guatemala,Tableros contrachapados,Apertura,,42401,06/04/2016,julio-2016,Finalizado,Se informa que La madera contrachapada no requiere permiso de importación por ser un producto procesado. ,,,,,,
,Panamá,Maderas aserradas secas en horno de Pinus radiata,Apertura,,42064,06/04/2016,2015,Finalizado,Panamá envío requisitos  al AA en septiembre del 2015. Recien en abril 2016 el SAG fue informado.,,,,,,
,Panamá,Requisitos fitosanitarios de cebolla ,Reapertura,,42401,06/04/2016,10-2016,Finalizado,"10.10.16 a través de la Nota adjunta AUPSA-DINAN-217-2016, Panamá da respuesta los comentarios enviados por SAG a través de la Carta N°5517/2016. Informando que ha respondido positivamente a la solicitud realizada por el servicio",,,,,,
,Paraguay,Cebollas frescas,Apertura,,42027,21/06/2016,,Pendiente  Paraguay,"21.06.16 a  través de la carta SAG N°3835/2016, se solicita  a SENAVE  el estado  de respuesta  del avance del ARP.",,,,,,
VIVEROS,Paraguay,"Plantines de frambuesa (Rubus ideaus, Variedad Pacific Majesty)",Apertura,,41671,21/06/2016,,Pendiente  Paraguay,"21.06.16 a  través de la carta SAG N°3835/2016, se solicita  a SENAVE  el estado  de respuesta  del avance del ARP.",,,,,,
,Paraguay,Semilla de Trigo (Triticum aestivum y Triticum turgidum L. spp durum)  ,Apertura,,41548,21/01/2016,,Pendiente  Paraguay,"21.06.16 a  través de la carta SAG N°3835/2016, se solicita  a SENAVE  el estado  de respuesta  del avance del ARP.",,,,,,
,Paraguay,Postes de madera de Pinus radiata,Apertura,,42339,17/06/2016,,Pendiente  Paraguay,"17.06.16 a través de la carta SAG N°3842/2016, se solicita la respuesta a la carta SAG N°7236/2015.",,,,,,
,Uruguay,Plantas de palto (Persea americana),apertura,,41913,13/07/2016,,Pendiente MGAP Uruguay,"13.07.2016  se solita a Uruguay información sobre el estado de avance de la información enviada para la realización del ARP, enviado en febrero del 2015. ",,,,,,
,Uruguay,Plantas de vid (Vitis Spp.),Apertura,,41852,13/07/2016,,Pendiente MGAP Uruguay,"13.07.2016  se solita a Uruguay información sobre el estado de avance de la información enviada para la realización del ARP, consulta realizada en julio del 2015. ",,,,,,
,Uruguay,Plantas in vitro de kiwi,Apertura,,42427,13/07/2016,,Pendiente MGAP Uruguay,"13.07.2016  se consultó a Uruguay  los requsitos para la internación de plantas in vitro de kiwi,  enviado en febrero del 2015. ",,,,,,
,Uruguay,Material de propagación de manzano,Apertura,,42593,11/08/2016,,Pendiente MGAP Uruguay,Desde agosto se espera la respuesta de Uruguay con el envio de los requisitos fitosanitarios.,,,,,,
,Corea,Plantas de Maqui,Apertura,,42401,,May-16,Finalizado,"El 19 de mayo, se recibe carta de QIA que informa que: Es posible exportar plántulas de Maqui de Chile a Corea mientras se cumplan los requisitos indicados por QIA en su carta, en relación al medio de crecimiento y otros requerimientos comunes.",,,,,,
,Colombia,Bulbos de tulipan ,Apertura,ICA,42401,18/04/2016,,Pendiente interesado,18 de abril se remite el cuestionario de ARP a la empresa en cuestión,,,,,,
,Colombia,Peras,Actualización de requisitos,ICA,41548,07/08/2015,,Pendiente ICA,"SAG envía información solicitada por ICA (carta SAG N° 4750/2015), se esperan sus comentarios.",,,,,,
,EE.UU,Higo (Ficus caricia),Apertura,,,,Dec-11,Finalizado,,,,,,,
,EE.UU,Uchuva (Physalis sp.),Apertura,,,,Dec-11,Finalizado,,,,,,,
,EE.UU,Baby Kiwi (Actidinia arguta),Apertura,,,,Dec-10,Finalizado,,,,,,,
,EE.UU,Granada (Punica granatum),Apertura,,,,Dec-10,Finalizado,,,,,,,
,EE.UU,Naranja (Citrus  sinensi),Apertura,,,,Dec-10,Finalizado,,,,,,,
,EE.UU,Pomelo (Citus paradisi),Apertura,,,,Dec-10,Finalizado,,,,,,,
,Bolivia,Esquejes enraizados vid,Apertura,CCI 2016-2017,42644,,,Pendiente Bolivia,"El 6 de octubre de 2016 (carta SAG N° 6094), se presenta el interés de exportar este producto y se consultan las exigencias de internación.",,,,,,
,Bolivia,Plantas de arándano,Apertura,CCI 2016-2017,,,Sep-16,Tema detenido, se iniciará apertura una vez avancen los procesos previamente presentados.,,,,,,
CHILEALIMENTOS,Bolivia,Esquejes de clavel con y sin raiz,Apertura,,42461,31/08/2016,,Pendiente Bolivia,A través de carta SAG Nº 5344/2016 se envía cuestionario respondido para ARP.  ,,,,,,
,Brasil,Bulbo de tulipan ,Facilitacion,,,,Feb-15,Finalizado. Pendiente solicitud de eliminación de Tulip breaking virus.,Brasil publica en su Diario Oficial (03.02.2015) la eliminación de los Requisitos Fitosanitarios al virus Lily symptomless virus. Pendiente solicitud de eliminación de Tulip breaking virus.,,,,,,
,Brasil,"SEMILLAS DE COLIFLOR, BRÓCOLI, PEPINO Y LECHUGA",Apertura,,,,Sep-15,Finalizado,"Brasil publica nueva normativa IN 16, que establece los requisitos de importación para semillas de varios orígenes destinadas a propagación. 03.09.15",,,,,,
,China,Avellanas sin cascara,Apertura,CCI2016-2017, 17.08.2016,Jan-16,,Pendiente Aqsiq, Por carta SAG N°5572/2016 se manifiesta interés de exportar este producto y se solicitan los requisitos fitosanitarios. Se adjunta monografía de proceso,,,,,,
,China,Frutas congeladas,Apertura,, 01.02.2014,Aug-16,,Pendiente Aqsiq," Por carta SAG N°5223/2016 se envía información acerca de estos productos, además de Resoluciones y Decreto Ley relacionadas.",,,,,,
,China,"Ciruelas deshidratadas al horno “Natural condition""",Apertura,CCI 2016-2017, 01.04.2016,Jul-16,Jul-16,Abierto," AQSIQ confirma que Chile ya puede exportar dicho producto a China a partir de ahora, ya que se considera que este producto está dentro del concepto de la “ciruela deshidratada” que China autorizó a exportar a China hace varios años. ",,,,,,
,China,"Plantas de berries: Arándano (Vaccinium corymbosum), mora (Rubus spp.) y frambuesa (Rubus idaeus)",Apertura,, 20.09.2016,Nov-16,,Pendiente Hortifrut, 04.11.2016: Se recibe comunicado desde AA y se comparte con DPAF y Hortifrut. Hortifrut enviará documento traducido. ,,,,,,
,China,Protocolo Nectarines,Apertura,, 01.08.2013,Nov-16,,Pendiente visita 10-enero 2017,Firma de Protocolo durante visita del Presidente de China a Chile el 22.11.2016. Se espera visita de inspección para finalizar el proceso de apertura.,,,,,,
,China,Requisitos Envíos maritimos terretres aereos. ,Facilitación,SAG, 01.01.2013,Nov-16,Nov-16,Finalizado,El Director Nacional debe firmar acuerdo inicializado por AA en China (el 09.11.2016). SAG  debe realizar trámites jurídicos para su entrada en vigencia.,,,,,,
,China,Modificación Protocolo Paltas,Facilitación ,SAG, 12.05.2016,Nov-16,Nov-16,Finalizado,El Director Nacional debe firmar acuerdo inicializado por AA en China (el 09.11.2016). SAG  debe realizar trámites jurídicos para su entrada en vigencia.,,,,,,
,China,Mosca de la fruta ,Facilitación,SAG, 12.05.2016,Sep-15,Sep-15,Finalizado,"El 8 de agosto 2015 AA informa que AQSIQ  ha aceptado el radio de 27.2 KM, y ha liberado a la Región Metropolitana, la V Región y la IV Región (con excepción de La Serena y San Esteban, que serán cuarentenadas con el nuevo radio de 27.2 KM). La parte China solicita a Chile que se cumpla con ciertas condiciones. El 22 de septiembre 2015, a través de carta SAG N°5693 se explica a AQSIQ el formato de la página web. ",,,,,,
,Corea,Semilla de zanahoria,Apertura,,42552,,Aug-16,Finalizado,Certificado fitosanitario sin declaración adicional y que están sujetas a la inspección en puerto en Corea.  ,,,,,,
,Corea,Madera  aserrada verde pino radiata,Actualización de requisitos,,42186,18/10/2016,,Pendiente SAG,"18.10.2016: C.Baek informa que QIA solicita estudio sobre Methylene bisthiocyanate, especialmente el efecto y la eficiencia del químico a Phythophthora pinifolia en la madera. Según QIA, existen antecedentes relevantes en las alternativas propuestas a través de la Carta SAG Nº 4931/2016, pero en el estudio adjunto ¨Potential of Phythophthora pinifolia to spread via sawn Green: a preliminary investigation¨ no se indica la relación con ese fungicida.  Se deriva esta información a DPAF, la cual es compartida a la industria el 20.10.2016. En espera de actualización.",,,,,,
,Guatemala,Flores de Tulipan ,Apertura,,,,Aug-14,Finalizado,"13.08.14 la AA envía oficio VISAR N°2158, donde indica los requisitos que debe cumplir el exportador",,,,,,
,México,Semilla de espárrago,Facilitación ,SAG,42522,01/07/2016,,Pendiente Mexico.," 14.06.2016: En carta SAG N°3746 se solicita la aprobación de SENASICA para el envío de semillas de espárrago con la dosis de captan (ingrediente activo), sugerida en Chile, ya que la dosis mayor recomendada por México, no está autorizada en nuestro país. Otras alternativas de plaguicidas tampoco están autorizadas para su aplicación en semillas.",,,,,,
,Paraguay,Semilla de canola ,Apertura,,42461,01/04/2016,,Pendiente  Paraguay,"01.04.16 Mediante carta SAG N°2008/2016, envía comentarios a los requisitos fitosanitario establecidos para semilla de canola procedentes de Chile, señalados en el AFIDI 201624848 del 28-03-2016",,,,,,
,Perú,Plantulas de Sandia,Apertura,,41334,05/08/2016,,Pendiente Perú,"En reunión bilateral del 3 de mayo 2016, se establece como Primera  prioridad ARP MP Carta 4856/2016. ",,,,,,
,Perú,Plantas in vitro cerezo,Apertura,,,05/08/2016,,Pendiente SAG,"El 2 de septiembre de 2015 en Carta 0436-2015-MINAGRI-SENASA-DSV y en relación a la propuesta de exigencias fitosanitarias para la importación de cerezo, SENASA envía sus comentarios a la solicitud de retirar ciertas plagas por parte de SAG y adjunta propuesta de exigencias definitiva. Cuarta Prioridad ARP MP (Carta 4856/2016)",,,,,,
,Perú,Plantulas de Damasco,Apertura,,41730,05/08/2016,,Pendiente Perú,"El 14 de enero de 2014 en carta SAG N°225, se envían comentarios a la propuesta de requisitos fitosanitario presentada por SENASA el año 2012 (se envían comentarios a 23 plagas).. Quinta prioridad SAG ARP MP.Carta 4856/2016)",,,,,,
,Perú,Plantas de Kiwi,Apertura,,41944,01/08/2016,,"Pendiente SENASA respuesta a exigencias fitosanitarias.Pendiente SAG, coordinar visita a vivero","El 21 de julio 2015, se envían comentarios a 15 plagas, Carta N° 4316. Queda pendiente el envío de fechas por parte de SAG para visita a los viveros. Octava prioridad ARP MP (carta SAG agosto 2016).",,,,,,
,Perú,Semillas cala ,Apertura,Empresa AgroFloral,42522,12/07/2016,,"Pendiente SAG, se iniciara una vez que avancn los otos temas.",El 12 de julio se informa que existen 15 aperturas en trámite y se esperaran avances para continuar con esta solicitud,,,,,,
,Perú,Semillas eucalipto,Apertura,Notificación SENASA G/SPS/N/PER/594,42064,01/08/2016,,Pendiente Perú, “Proyecto de Resolución Directoral para el establecimiento de requisitos fitosanitarios de necesario cumplimiento en la importación de semilla de eucalipto (Eucalyptus spp.) de origen y procedencia Chile”. En agsoto 2016 se solicita aSENASA confirmar que este asunto esta finalizado.,,,,,,
,Perú,Plantas de arándano,Facilitación ,SAG,42614,,,Pendiente Perú,"El 1 de septiembre (Carta SAG N° 5398/2016), se solicita modificar método de aplicación de los tratamientos, se ofrece método alternativo. ",,,,,,
,Perú,Astillas de pino secas,Apertura,,42583,14/09/2016,,Pendiente interesado,"SAG solicita a interesado respuesta a las preguntas destacadas del cuestionario que se adjunta, con el fin de que SENASA (nuestra contraparte) establezca las exigencias de ingreso. ",,,,,,
,Bolivia, Semillas de pepino,Apertura,,42309,16/08/2016,,Pendiente interesado,"El 16 de agosto de 2016, empresa informa que se encuentra preparando antecedentes. ",,,,,,
,China,Exportación de Cerezas en bodegas de naves ,Facilitación,SAG, 12.05.2016,Jan-16,Jan-16,Finalizado,"El 28 de enero 2016, en Beijing, se firma acuerdo entre el Ministro de Agricultura de Chile y el Ministro de AQSIQ de China.",,,,,,
,China,Peras,Apertura,CCI 2016-2017, 27.10.2016,Oct-16,,Pendiente SAG,"Carta  SAG N°6487/2016, solicitando requisitos es retenida hasta la oficialización del protocolo de nectarines.",,,,,,
,Corea,Plantas de Araucaria (Araucaria spp.) ,Apertura,,42186,,Mar-16,Finalizado,,,,,,,
,Corea,"Envíos maritimos- aereo, transito 3er país.",Facilitación,SAG,42522,14/09/2016,,Pendiente Corea,"14.09.2016: Por carta SAG N°5658/2016 se solicita a QIA confirmar la factibilidad de realizar embarques aéreos, embarques mixtos de fruta, además de la combinación de embarques marítimos y aéreos, como se menciona previamente en carta SAG N°3540/2016.",,,,,,
,EE.UU,Plantas enraizadas de hortensia (Hydrangea macrophylla),Apertura,,42461,01/08/2016,,Pendiente EEUU,01.08.2016: Mediante carta SAG N°4677/2016 se solicita iniciar ARP. A la espera de envío de cuestionario para ser completado por empresa interesada y SAG.,,,,,,
,EE.UU,Plantas convencionales e in vitro de Zarzamora (Rubus fruticosus) y Frambuesa (Rubus idaeus),Apertura,,42156,18/05/2016,,Pendiente EEUU,18.05.2016: Mediante carta SAG N°3174 se envía cuestionario consolidado. En análisis de APHIS. ,,,,,,
,Guatemala,Plantas de arándanos (Vaccinium spp.) ,Apertura,CCI 2016-2017,42614,,,Pendiente Guatemala,"22.09.16 se envía carta SAG N° 5427/2016, señalando el interés de los productores nacionales en exportar plantas de arándanos (vaccinium spp.) ",,,,,,
