,Brasil,Granadas y arilos de granada,Apertura,,40238,30-novimbre-2016,,Pendiente Brasil,"En noviembre de 2014, la Agregaduría entró en contacto con el centro colaborador que realizó el ARP (agronómica), quienes avisaron que los informes finales ya fueron enviados al DSV del MAPA, pero a la fecha no tenemos noticias de dichos resultados.Luego de la reunión con al AA en noviembre del 2016,  señalo que el MAPA ha repriorizado los temas, granada y arilos de granada serían una prioridad para el 2017. ",,,,,,
,Brasil,Flores de Tulipan ,Apertura,,41507,01/11/2016,,Pendiente Centro Colaborador,"En 2016, según la información entregada por la AA en Brasil, se acordó entre la AA, el DSV-MAPA y el Centro Colaborador que este último enviaría a la DSV del MAPA  un informe auxiliar para la especie Tulipa gesneriana. ",,,,,,
,Ecuador,Semilla de lechuga,Facilitación,SAG,42430,08/08/2016,Aug-16,Finalizado,"El 26 de agosto (Oficio Nro. MAGAP-CSV/AGROCALIDAD-2016-000503-OF), se acepta solicitud de SAG y se adjuntan exigencias definitivas.",,,,,,
,Brasil,Semilla de esparrago,Apertura,,42200,24-07.2015,,Pendnte SAG,"Definido por la DPAF como 4° priorización (30 marzo 2016).Pendiente SAG, debe enviar carta a la ONPF Brasileña solicitando inicio del proceso de ARP.",,,,,,
,China,,Apertura,,01.01.2015,Aug-16,,Pendiente SAG,"AQSIQ mandó una nota formal para explicar los pasos que se deben seguir para lograr la autorización de China, incluyendo un cuestionario que debe ser rellenado. Dicho cuestionario se está traduciendo para ser contestado. Se considerará la postergación del mismo. ",,,,,,
,China,Actualización Protocolos de Kiwi  y Manzana,Facilitación,, 23.04.2013,Jun-16,,Tema detenido. ,"AQSIQ señala que para incorporar nuevas regiones a los Protocolos vigentes, es necesario realizar un nuevo ARP; además, considerando además el hecho que los actuales protocolos tiene más de 10 años y que sería necesario actualizarlos, lo cual implicaría distraer a los técnicos del AQSIQ",,,,,,
,China,"Plan de Acción Convenio Cooperación en Inspección y Cuarentena de Frutas Frescas entre Chile y China, 2016",Mantención,, 04.04.2016,Sep-16,Sep-16,Finalizado, El 2 de septiembre de 2016 se firma Plan para el período 2016- 2017. ,,,,,,
,China,Esparragos,Apertura,CCI 2016-2017,19.08.2016,28/09/2016,Sep-16,Tema detenido. ,"28.09.2016: AA envía carta de respuesta de AQSIQ No. 781/2016, la que adjunta “extenso” cuestionario para ser llenado por SAG, sin embargo, dado que existen otras prioridades, se considerará la postergación del mismo. ",,,,,,
,Corea,Paltas,Apertura,CCI2016-2017,,,,Pendiente SAG,2.12.2016: ODEPA informa a Sag de su priorización,,,,,,
,Taiwan ,Ajo fresco y tallos de ajo (Allium sativum,Apertura,,42583,12/09/2016,,Pendiente Chile,"Pendiente exportador: 12.09.2016: Se reenvía documento al interesado para ser completado y enviado a Taiwán para ARP. Para tallos, debe incluir declaraciones adicionales que SAG está analizando",,,,,,
,Taiwan,Semilla de zanahoria,Apertura,,42552,28/09/2016,,Pendiente Taiwan,"28.09.2016: Por carta SAG N°5928/2016 se comunica a BAPHIQ, que según Res.N°3080 (adjunta), D.dipsaci es una plaga cuarentenaria ausente en Chile, por lo que propone incluir esta información como Declaración Adicional en el Certificado Fitosanitario",,,,,,
,Japón,Bulbos de lilium,Actualización de requisitos,,42095,29/06/2016,juno-2016,Finalizado,MAFF aceptó las medidas sugeridas por el SAG para el caso del virus Plantago asiatica mosaic virus (PlAMV). MAFF está modificando “the ordinance for Enforcement of the plant protection act and relevant notifications” que entrará en vigencia el 24 de noviembre de 2016.,,,,,,
Rijk Zwaan Chile ,México,"Semillas de berenjena,  espinaca, rábano y calabacita",Apertura,SAG,42125,22/02/2016,,Pendiente interesado,"Sanidad vegetal envia iormacion para berenjena, espinaca y rabano. Par alabacita solicita informacion de productor teresado par lvantar inormacion fitosanitaria. ",,,,,,
,Irán,Nueces con cascara,Apertura,Gremio,42491,17/11/2016,,Pendiente MINAGRI Iran,"En noviembre 2016, se presenta interes de exportar este producto vía mail al MINAGRI de Iran, esto debido a que la ONPF comentó que nuez es un producto prohibido y la solicitud de ARP debe ser dirigida a dicha entidad.",,,,,,
,Malasia,Madera aserrada seca E. regnans,Apertura,ProSylva,42552,28/11/2016,,Pendiente Malasia,"Cuestionario de ARP enviado a fines de noviembre, pendiente analisis ONPF Iran.",,,,,,
,Perú,Plántulas de fresa,Apertura,,41426,01/07/2015,Mar-15,Finalizado,"El 11 de marzo de 2015 se publica Resolución Directoral N° 0011-2015-MINAGRI-SENASA-DSV, que establece requisitos para plantas de fresa origen Chile.",,,,,,
,Perú,Varas yemeras de cerezo,Apertura,,41791,06/11/2014,Jan-15,Finalizado,"El 22 de enero, se recibe vía punto de contacto SPS notificación G/SPS/N/PER/583/Add.1, en la cual Perú informa que el 31 de diciembre se publicaron en Diario Oficial (Resolución Directoral N° 0062-2014-MINAGRI-SENASA-DSV), los requisitos para este producto.",,,,,,
,Perú,Coronas esparragos ,Apertura,,41153,01/08/2016,,Pendiente Perú,"Sexta prioridad SAG (carta SAG agosto 2016). 28 de septiembre de 2012 en carta SAG N°11489, DPAF envía comentarios respecto a la propuesta de requisitos entregados por Perú (carta N° 257 de 19 de julio de 2012). En carta N°1875 del 6 de Junio del 2013, SAG envía nuevos comentarios.",,,,,,
,Perú,Plantas de nogal,Apertura,,,18/05/2015,Mar-15,Finalizado,"El 11 de marzo 2015, se recibe vía punto de contacto SPS notificación G/SPS/N/PER/559/Add.2 “Norma que establece los requisitos fitosanitarios de necesario cumplimiento de la importación de plantas de nogal de origen y procedencia Chile” en la cual Perú informa que el 13 de febrero se publicaron en Diario Oficial (Resolución Directoral N° 0062-2014-MINAGRI-SENASA-DSV).El 18 de mayo de 2015 se remite Nota SAG N° 2685/2015, solicitando respuesta a Nota SAG N°397/2015 de enero del presente año. Se hace hincapié en que las plagas Cherry leaf roll virus, Eutypa lata y Plum pox virus corresponden a plagas cuarentenarias ausentes en Chile.",,,,,,
,Perú,Flores frescas cortadas de rosa (Rosa spp.,Apertura,,,01/08/2016,,Pendiente Perú,"En nota SAG de agosto 2016, se solicita última carta remitida por SENASA respecto a este asunto (24.10.11), con el fin de evaluar la conformidad con las exigencias propuestas",,,,,,
,Perú,Plantas in vitro de zarzamora,Apertura,,agoto-2014,Aug-16,,Pendiente Perú,El 24 de mayo 2016 se envían antecedentes del ARP (carta SAG N° 3338/2016).Sexta prioridad SAG (carta SAG agosto 2016),,,,,,
,Perú,Esquejes de clavel con y sin raiz,Apertura,,42583,,,Pendiente Perú,El 31 de agosto se envía cuestionario de ARP mediante Nota SAG N° 5343/2016,,,,,,
ANPROS,Vietnam,"Reapertura:Reemisión de permisos de exportación para Kiwi, Manzana, Cereza y Uva",Reapertura,SAG,41974,30-0ctubre-2016,,Pendiente Vietnam,"En reunión MSF (Hanoi, julio 2016) Vietnam indica que finalizado tema de mosca de la fruta se avanzara con ARP de estas frutas. El 2 de noviembre 2016, se recibe Nota No. 15/BVTV-CHL donde Vietnam reconoce a Chile como país libre de Ceratitis capitata. Adicionalmente solicita información de Drosophila simulans.El 30 de octubre 2016, se envía propuesta de protocolo para la exportación de uva fresca.",,,,,,
ANPROS,Vietnam, ARÁNDANO Y LIMÓN (FRUTA FRESCA),Apertura,Gremio,41944,06/07/2016,,Pendiente interesado,El 6 de julio 2015 se solicita respuesta de cuestionario a ASOEX.,,,,,,
,Vietnam,Bulbos de lilium spp,Apertura,,41944,12/09/2016,,Pendiente Vietnam,"El 8 de septiembre 2016, el PPD de Vietnam establece exigencias y abre el mercado, aceptando solicitud de Chile referida a D. dipsaci. El 12 del mismo mes SAG solicita modificación.",,,,,,
,Kenia,Plantas de frutilla,Facilitación,SAG,42491,19/05/2016,Aug-16,Finalizado,"6.04.2016: Se recepciona PI de Kenya para exportación de plantas de frutilla. 19.05.2016: A través de carta N° 3224/2016 se envía  propuesta de requisitos de importación para plantas de frutilla (Fragaria ananasa), de origen Chile. El 2 de agosto 2016 Kenia acepta propuesta",,,,,,
